{"profile":"Caelestis-Runtime-State-1.0","aiSystemId":"sys:example","deploymentId":"dep:example","snapshotAt":"2026-08-08T02:00:00Z","lifecycleState":"operation","aiBomReference":"Governance/Standards/examples/caelestis-ai-bom-1.0.example.json","effectiveElements":{"cognitionModelRef":"model:example-llm:2026-08","governanceConfigurationRefs":["control:tool-gate:v3"],"toolingRefs":["service:retrieval:example-kb"]},"relational":{"participantCount":2,"participantTypes":["human_participant","ai_system"],"coordination":"orchestrated","institutionalMediation":"service_mediated","distribution":"single_service","persistence":"cross_session","dependency":"moderate","jurisdictionalReach":"single_jurisdiction","impactScope":"individual"},"effectivePermissions":["tool:calendar.read"],"effectiveControls":["control:human_approval"],"reviewTriggers":["configuration_change","permission_change"],"evidence":{"posture":"observed","basis":"Signed configuration capture","reference":"snapshot:example","assignedBy":"operator:example"}}
